{
  "schemaVersion": "2026-10-01",
  "clientTurnId": "turn_fixture02",
  "messageId": "msg_user_fixture02",
  "runId": "run_demo0002",
  "status": "accepted",
  "notice": {
    "kind": "secret_removed",
    "title": "Recovery code removed from your message",
    "summary": "Garderobe removed a recovery code from your message before saving it; it was not stored, sent to the assistant or included in exports. If it is your current code, create a new one in Garderobe, since pasted codes should be treated as exposed.",
    "redacted": [
      {
        "kind": "recovery_code",
        "count": 1
      }
    ]
  }
}
